,Date_time,city,state/province,country,UFO_shape,length_of_encounter_seconds,described_duration_of_encounter,description,date_documented,latitude,longitude
152,2/6/2009 19:00,oakville,mo,us,triangle,60,1 minute,I seen a large craft hovering still about 1&#44000 feet away with 3 lights in the form of a wide obtuse triangle.,3/19/2009,38.47,-90.3044444
153,3/25/2010 18:00,colcord,ok,us,changing,120,2 minutes,strange lights in Oklahoma sky outside Siloam Springs Arkansas March 25&#44 2010,4/13/2010,36.2641667,-94.6927778
154,9/5/2001 21:30,healdsburg,ca,us,rectangle,900.0,15 min.,Not made in U. S. of A.,10/12/2001,38.6105556,-122.8680556
155,9/3/2011 22:00,mississauga (canada),on,ca,circle,120.0,2 minutes,I was looking up into the sky when I noticed a flying object over my street. It seemed very far away because I could see a plane flying,10/10/2011,43.15,-79.5
156,1/13/1999 07:15,rio rancho,nm,us,circle,3,2-3 seconds,Driving east from Rio Rancho into Albuquerque on Paseo Del Norte&#44 I viewed a perfectly lit circle above the Sandia Mountains.  The circ,2/16/1999,35.2333333,-106.6638889
157,9/22/2012 17:15,oakland,ca,us,changing,1800.0,30 minutes,Strange brights lights above Oakland Zoo,9/24/2012,37.8044444,-122.2697222
158,12/24/2011 22:00,boise,id,us,circle,1800,30 minutes,Bright red star at about 30 degrees above eastern horizon.  ((NUFORC Note:  Possibly Sirius?  PD)),1/12/2012,43.6136111,-116.2025
159,7/27/2008 03:00,honesdale,pa,us,triangle,3600,1 hour,many triangled shaped crafts hover over airport,8/12/2008,41.5766667,-75.2591667
160,10/17/2013 07:00,san jose,ca,us,other,5,5 seconds,Object&#44 large in nature&#44 with a bright white light tail entering the atmosphere in California.,10/23/2013,37.3394444,-121.8938889
161,8/12/1999 21:25,fresno,ca,us,unknown,3,3 sec,three lights traveling west to east&#44in a triangle formation&#44 or one large object&#44 very high and faster than anything I know of,8/30/1999,36.7477778,-119.7713889
162,11/18/1998 21:15,dunns mills,nj,us,disk,600,10 minutes,Well lighted disc craft lands off NJ Turnpike at Dunns Mills witnessed by two and exits off very fast.,2/23/2011,40.1291667,-74.6938889
163,7/31/2001 23:50,blanchester,oh,us,triangle,600,8-10 minutes,smooth&#44 rounded&#44 silent&#44 triangular object  following me...,8/5/2001,39.2930556,-83.9888889
164,3/21/1998 22:30,san antonio,tx,us,formation,1800,30 minutes,First 7 then up to a dozen lights at very high altitude darting around.,5/15/2006,29.4238889,-98.4933333
165,6/13/1996 22:45,temple,tx,us,diamond,5,4-5 sec,Diamond-shaped cluster of nonblinking white lights&#44 objects indistinct&#44 low altitude as planes ahd been flying overhead for an hour&#44 si,1/28/1999,31.0980556,-97.3425
166,2/1/2002 22:30,fitchville,ct,us,oval,60,1min,clear night about 2000 to 3000 feet in the sky two beams emitted from craft beam lenght uncertian but very bright  smaller beam disappe,2/22/2002,41.5647222,-72.1544444
167,8/10/2009 23:00,martinez,ca,us,oval,3600,1 hour,Red light over Conta Costa County,8/27/2009,38.0194444,-122.1330556
168,5/28/2006 23:30,adkins,tx,us,sphere,60,1 min,Bright blue sphere&#44 hovered then darted east and disappeared.,7/16/2006,29.3927778,-98.2369444
169,5/15/1953 16:00,toronto (canada),on,ca,disk,30,20-30 sec,3 discs in formation flipping into clouds and descending  out of them.,12/19/2003,43.666667,-79.416667
170,2/23/2006 00:45,goshen,in,us,other,37800,1 1/2 hrs,I don&#39t know what it was&#44 but we watched for 2 hrs&#33  I can&#39t wait to see if it happens again tonight&#33,3/11/2006,41.5822222,-85.8344444
171,11/2/2001 17:40,roseville,ca,us,light,120,2 minutes,Bright light over I-80 East at Douglas. The light shot horizontally toward the East leaving a trail of light and disappeared.,11/20/2001,38.7522222,-121.2869444
172,8/25/2001 23:59,oak harbor,wa,us,light,1800.0,30 minutes,Lights on Whidbey Island,10/12/2001,48.2933333,-122.6419444
173,10/11/2010 19:40,cottage grove,mn,us,light,240,3-4 minutes,Craft with two white lights in Minneapolis Approach Pattern that moved down and not forward then disappered behind the tree line.,11/21/2010,44.8277778,-92.9436111
174,7/14/2010 13:00,englewood,co,us,oval,540,9 min,I think about this almost every day and how lucky I was to witness this&#33 There really are ET&#39s,7/4/2012,39.6477778,-104.9872222
175,11/7/1996 23:30,seattle,wa,us,sphere,7,7 sec.,Dimly lit group of colored objects hovering over the Woodland Park Zoo emitting light beams similar to spotlights.I was walking my,3/7/1998,47.6063889,-122.3308333
176,12/1/2001 22:20,sioux center,ia,us,unknown,60,1 min. or less,I WAS WATCHING TV WHEN I NOTICE 2 OBJECTS WITH BLUEISH@RED LIGHTS COMEING OVER THE ROOF OUTLINES OF THE HOUSES JUST SOUTH OF MY HOUSE.,12/5/2001,43.0797222,-96.1752778
177,8/24/2013 22:30,o&#39fallon,mo,us,sphere,1200.0,20 minutes,Seven orange orbs in the formation of the Big Dipper that individually hovered and moved across the sky acscending to the atmosphere.,8/30/2013,38.8105556,-90.6997222
178,8/2/2001 23:21,hillsboro,or,us,oval,180.0,3min,Orange satillite enlarges 5 times its size as it flairs to white-blue&#44 then back to original size and color .,8/5/2001,45.5230556,-122.9886111
179,2/26/2001 22:50,levittown,pa,us,light,5,5 seconds,it was mostly clear just a few light clouds.there are a lot of lights around my house so only the brightest stars are visible to the na,3/6/2001,40.155,-74.8291667
180,10/23/2007 20:30,medford,or,us,unknown,300,5 minutes,Changing color&#44 rotating lights with a hazy&#44 &quot;v-shaped&quot; short light beam beneath.,11/28/2007,42.3266667,-122.8744444
181,7/5/2002 22:30,seattle,wa,us,light,1800,30 minutes,Bright light appeared to (perhaps) be hovering closely outside of earth&#39s atmosphere,7/26/2002,47.6063889,-122.3308333
182,7/26/2006 04:30,fresno,ca,us,light,30,30 sec,fresno early morning sighting,10/30/2006,36.7477778,-119.7713889
183,12/28/2013 23:00,maricopa,az,us,light,10,10 seconds,Bright orangish light moving fast and silent right over the house.,1/10/2014,33.0580556,-112.0469444
184,8/9/1974 12:00,spokane,wa,us,other,10.0,10 seconds,I was 11 years old and happened to be in a car with my mom&#44 and we saw a bullet shaped craft with flames comming out of the rear. I hav,6/18/2004,47.6588889,-117.425
185,8/26/2004 22:00,chatsworth,nj,us,unknown,120.0,2 minutes,Object hovers slightly above tree level until it dissappears into the forest,5/24/2005,39.8175,-74.5352778
186,10/6/2002 13:55,union,nj,us,cross,120,2 minutes,At 1:55 p.m. on October 6&#44 I looked toward the east over Union&#44 N.J.&#44 and saw what appeared to be two extremely small&#44 white aircraft t,10/15/2002,40.6975,-74.2636111
187,11/10/2013 21:00,jonesboro,ar,us,rectangle,120,2 minutes,Flying Box with No Marker Lights,11/20/2013,35.8422222,-90.7041667
188,8/12/2005 21:00,mesa,az,us,light,60,60 sec,star takes off&#33,9/2/2005,33.4222222,-111.8219444
189,12/20/2008 19:40,cedar park,tx,us,light,4,3-4 seconds,I observed a brillian&#44 white&#44 ball of light flying at tremendous speed from West to East.,1/10/2009,30.505,-97.82
190,9/2/2007 16:30,louisville,ky,us,sphere,300.0,5 mintues,Two metallic spheres hovering in sky then vanishing as jet plane passes nearby.,3/4/2008,38.2541667,-85.7594444
191,4/19/2010 21:20,cocoa,fl,us,unknown,30,30 secs,Four green lights seen close to the ground while driving,5/12/2010,28.3858333,-80.7422222
192,1/15/2013 02:20,irvington,ny,us,unknown,1200,20 minutes,UFO with colored moving lights and symbols on it,8/30/2013,41.0388889,-73.8655556
193,8/4/2013 02:26,dayton,oh,us,fireball,180.0,3 minutes,Shape changing fireball that hovered close to the ground an flew off with incredible speed,8/30/2013,39.7588889,-84.1916667
194,10/6/2003 22:53,kansas city,mo,us,teardrop,5,5 seconds,the object&#44while lit&#44 flew faster than any plane I&#39ve ever seen.,10/7/2003,39.0997222,-94.5783333
195,9/17/1999 01:00,hinsdale (unincorporated area),il,us,other,3600.0,1 hour,i feared for my life,12/7/2006,41.8008333,-87.9369444
196,10/19/2007 15:00,banks,or,us,sphere,8,8 seconds,SR-71&#39s over Washington County? I dont think so&#33,11/28/2007,45.6188889,-123.1130556
197,10/4/2013 13:00,fowler,ca,us,rectangle,600,10 minutes,Hovered solid black square/rectangle shaped object had no sound and no lights.,10/14/2013,36.6305556,-119.6775
198,1/10/2006 12:30,elmira,ny,us,light,7200,2 hours,My wife noticed it first at 12:30 AM on the porch.  She called me out and I saw it too.  We decided to walk down near the Chemung river,2/14/2006,42.0897222,-76.8080556
199,7/9/2010 01:59,antioch,ca,us,cigar,180,3 min.,07/09/2010&#44 Antioch&#44 CA; oblong&#44 3 min.&#44 luminous red orange&#44 3 x&#39s larger than a small plane&#44 pulsing soft noise&#44strait low flight.,7/10/2010,38.005,-121.8047222
200,8/29/2011 22:50,morgantown,wv,us,triangle,20.0,20 seconds,Y-shaped or triangular object in the sky overhead&#44 traveling westward.,10/10/2011,39.6294444,-79.9561111
201,4/23/2014 22:15,dauphin island,al,us,formation,10,10 seconds,Light formation that extinguished one by one from west to east over the Gulf of Mexico at Dauphin Island&#44 AL,5/2/2014,30.2552778,-88.1097222
202,4/17/2002 20:55,sebastopol,ca,us,light,60,1 min.,two &quot;star-like&quot; objects traveling in parallel,4/25/2002,38.4022222,-122.8227778
203,4/18/2010 20:00,missoula,mt,us,unknown,5,5 seconds,Single steady white light cruising&#44 then tears out into space having an orange glow behind it.,3/16/2012,46.8722222,-113.9930556
204,9/27/2013 05:00,ozark,ar,us,circle,2.0,2 seconds,Yellowish orange orb moving horizonally&#44 low to the ground at a very high rate of speed with no sound&#44 no tail,9/30/2013,35.4869444,-93.8275
205,9/23/2002 21:30,bridgewater (canada),ns,ca,light,900.0,15 minutes,point of light preformed arcing movements and speed impossible for any other aircraft,10/7/2003,44.366667,-64.516667
206,8/13/2011 22:00,dennis port (cape cod),ma,us,unknown,600.0,5 -10 min,Slow moving unusual brilliant liquid white like single object over Cape Cod,8/21/2011,41.6583333,-70.1291667
207,11/10/2012 21:00,kittanning,pa,us,teardrop,2,0:02,I was waiting to cross rte 66 from the east to go west and had noticed what i thought to be something on top of a flag pole&#44but i could,2/4/2013,40.8163889,-79.5222222
208,12/30/2012 20:15,red river,nm,us,sphere,20,20 seconds,Brilliant Blue Orb over Red River&#44 New Mexico - Stunning Movements.,1/10/2014,36.7080556,-105.4055556
209,6/25/2002 23:30,aberdeen,wa,us,circle,15,15seconds,STAR LIKE OBJECT MOVING QUICKLY FROM SW TO NE,7/1/2002,46.9755556,-123.8144444
210,7/29/2007 22:30,chicago,il,us,circle,5,five seconds,Circular flying object moving westward over Chicago,8/7/2007,41.85,-87.65
211,6/28/2007 21:00,seattle,wa,us,other,1200,20 min,Black blob moving over Seattle,8/7/2007,47.6063889,-122.3308333
212,12/2/2009 18:30,san dimas,ca,us,oval,600,10 min or less,Object of animated lights off 210 free in California.,12/12/2009,34.1066667,-117.8058333
213,1/9/2007 07:35,pontiac,mi,us,sphere,1200,20 minutes,..It split into two halves-like a &quot;Pac-Man&quot; mouth.,2/1/2007,42.6388889,-83.2911111
214,8/4/2012 23:05,huntington,in,us,light,180.0,3 minutes,Pink lighted unknown object in sky over Huntington,8/5/2012,40.8830556,-85.4975
215,7/22/2012 02:00,charlotte,mi,us,light,3600,1 hour,Several pulsating lights performing impossible maneuvers in the night sky,8/5/2012,42.5636111,-84.8358333
216,7/5/2000 05:47,seattle,wa,us,light,4,2-4 second,On my way home entering the Ballard bridge I look up in the sky to enjoy the scienery. At the same time I notice a bright green light p,8/19/2000,47.6063889,-122.3308333
217,8/13/1998 03:00,hampton,nh,us,circle,5.0,3-5 seconds,Moon size&#44 like object&#44 quiet&#44 white and bright August 1997-1999 3:00 AM. Any one else?,5/15/2006,42.9375,-70.8394444
218,10/24/2006 04:50,san jose,ca,us,circle,14,14 seconds,At approximately 4:50am a lighted circlular object was spotted streaking across the sky traveling from West to Nortwest and entered my,10/30/2006,37.3394444,-121.8938889
219,10/3/2003 18:45,quesnel (canada),bc,ca,other,480,8 minutes,HBCCUFO CANADIAN REPORT:  An oblong in shape and traveling at an angle of approx: 30 degrees.,10/15/2003,52.983333,-122.483333
220,7/1/1956 16:00,beatrice (14 mi sw of),ne,us,other,120,2 minutes,Large pale silver dome seen over a hill and also near the house of SE Nebraska farm.,7/13/2005,40.2680556,-96.7466667
221,5/28/2008 16:50,lisle,il,us,circle,600,10 minutes,Afternoon sighting of 15+ ufo&#39s that changed colors and were the size of stars in the night sky.,6/12/2008,41.8011111,-88.0747222
222,10/5/2005 21:00,toledo,oh,us,light,2880,48 min,Point source of light observed for 48 min in rapid acceleration and deceleration and apparent stationary flight,10/11/2005,41.6638889,-83.5552778
223,10/28/2011 06:30,anderson,sc,us,light,60,less than 1 min.,Odd light effect in clouds,12/12/2011,34.5033333,-82.6502778
224,6/1/1968 00:00,binghamton,ny,us,disk,2700,half an hour+,UFO saucer seen Binghamton&#44 NY&#44 1968-69,3/4/2008,42.0986111,-75.9183333
225,10/10/2011 21:00,york,pa,us,circle,15,15 seconds,BRIGHT LIT ORB SPEEDS ACROSS S.CENTRAL PA. SKY&#44 MAKING NO SOUND&#44 THEN DISAPPEARS,10/19/2011,39.9625,-76.7280556
226,6/10/2012 22:50,lima,oh,us,circle,120,2 minutes,Bright reddish orange orb shoots across sky with no sound at a high rate of speed at 10:30pm in Lima&#44 oh.,6/14/2012,40.7425,-84.1052778
227,1/3/2013 20:03,weaverville,ca,us,sphere,7,7 seconds,Night sighting and not a convential aircraft,2/4/2013,40.7311111,-122.9408333
228,6/1/1975 00:10,douglas,az,us,circle,1800,30 minutes,F4 Fighter-Intercepters scrambled to intercept object at over 90&#44000 foot altitude,9/2/2005,31.3444444,-109.5447222
229,9/12/2010 21:00,toms river,nj,us,cigar,3.0,3 sec,Cigar shaped haze with two rectangular windows.,11/21/2010,39.9536111,-74.1983333
230,8/19/2012 21:15,porter,in,us,unknown,900.0,15 minutes,I saw an orange fireball surrounded by a white triangle of lights in the sky.,9/24/2012,41.6155556,-87.0741667
231,7/7/2010 23:00,gaston,or,us,circle,180,2-3 minutes,Glowing orange orb in sky,7/10/2010,45.4363889,-123.1383333
232,12/12/2009 18:10,troy,il,us,circle,600,10 min.,2 bright lights near St. Louis that flew in a circular&#44 erratic pattern,2/14/2010,38.7291667,-89.8830556
233,7/31/2006 02:00,san antonio,tx,us,other,300,5 minutes,((HOAX??))  Flying object that looks like a Hawk or Eagle,3/4/2008,29.4238889,-98.4933333
234,6/24/2005 22:50,girard,oh,us,triangle,37800,11/2 hrs,SMALL TRIANGULAR LIGHTS AT HIGH ALTITUDE FLARING BRIGHTLY THEN DIMMING OUT .AFTER FLYING SHORT DISTANCE,7/5/2005,41.1538889,-80.7016667
235,5/1/1998 18:30,new york city (manhattan),ny,us,triangle,600,5 - 10 minutes,Strangely moving craft&#44 zigzagging in the distance that turned out to be a huge triangle with lots of lights when it flew overhead..,1/22/2004,40.7141667,-74.0063889
236,4/16/2009 22:00,fremont,in,us,light,3600,1 hour plus,A star like object that hovered and appeared to change color.,5/12/2009,41.7308333,-84.9327778
237,2/11/2004 06:45,cathedral city,ca,us,circle,150,2.5 minutes,bright round shape object traveling from south to north same area three times at diferen dates around the same hours.,6/4/2004,33.7797222,-116.4644444
238,11/23/2006 18:50,blue springs,mo,us,light,50,<min,Two lighted objects of varying intensity intersect  @ same location in space within 20 seconds of each other.,12/7/2006,39.0169444,-94.2813889
239,5/17/2006 24:00,holland,tx,us,unknown,5,5 seconds,white light  suddenly emitted bright  white light in center yellow on middle and red on outside of emitted circle of  huge   display,7/16/2006,30.8780556,-97.4013889
240,8/21/1994 22:35,circleville,oh,us,triangle,20.0,20 seconds,On Sunday night&#44 August 21&#44 1994&#44 at 10:35p.m.&#44 a triangle-shaped craft was observed flying over U.S. Route 23 in front of the local Du,11/2/1999,39.6005556,-82.9461111
241,12/7/2012 21:25,kingston,ny,us,light,300,5 minutes,Two Lights seen over Hudson River in Kingston&#44 NY on 32 South.,12/12/2013,41.9269444,-73.9977778
242,4/23/2010 20:15,coquitlam (canada),bc,ca,unknown,120,2 min.,Object circling the Moon.  ((NUFORC Note:  Date is wrong.  Possible hoax.  PD)),5/12/2010,49.266667,-122.783333
243,4/13/2005 17:30,redmond,wa,us,changing,420,5-7 minutes,The object moved like a pendulum in mid-air moving upwards&#44 stopping in mid-swing-in front of the clouds.,4/16/2005,47.6741667,-122.1202778
244,11/3/2013 20:00,flagstaff,az,us,changing,1200,20 minutes,Shape in sky disappearing and reappearing.,11/11/2013,35.1980556,-111.6505556
245,9/6/2011 23:30,fountain,co,us,unknown,300.0,5 minutes,5 Red light object floating over Fountain&#44 CO,10/10/2011,38.6822222,-104.7002778
246,4/15/1998 08:00,passaic,nj,us,other,10,10 seconds,I looked out the window at the sky about 8am in the morning. It was perhaps mid April with very puffy white spring clouds set against a,3/21/2003,40.8566667,-74.1288889
247,12/23/1987 22:00,ocala,fl,us,triangle,120,two minutes,Strange transparent objec t with red lights at joints seen around 10 pm moving northeast very slowly.,7/1/2002,29.1869444,-82.1402778
248,2/8/2011 19:15,brockton,ma,us,light,30,30 secs,Three glowing ambers lights flying in a formation over Brockton&#44 MA,2/8/2011,42.0833333,-71.0188889
249,7/9/2001 22:30,mountlake terrace (seattle),wa,us,disk,10,10 seconds,Lynnwood  W.A.  spherical with lights,8/5/2001,47.7883333,-122.3075
250,6/4/2005 23:00,creston,nc,us,flash,120,2 minutes,Fast flying object that zig zagged across the sky.,6/20/2005,36.4277778,-81.6238889
251,9/29/2012 19:58,woodbridge,ct,us,fireball,120.0,2 minutes,Flame-like object in sky,10/30/2012,41.3525,-73.0088889
252,5/29/2012 22:15,summerville,sc,us,fireball,60,1 minute,Large&#44 bright green light accomanied by a deep whirring noise,6/5/2012,33.0183333,-80.1758333
253,11/10/1999 10:35,henderson,ky,us,light,2700,45 minutes,One lighted object that was tracked by aircraft at two different times&#44 th aircraft altered their prior flight pattern.,3/4/2008,37.8361111,-87.59
254,4/17/2009 10:10,toronto (canada),on,ca,circle,1800,30 min,Hovering object flickering overtop Toronto&#33,5/12/2009,43.666667,-79.416667
255,10/10/2004 19:00,ripley,ny,us,circle,900,15 min,7 red/orange stationary objects appeared over Lake Erie on 10/10/04 for 15 minutes and then all disappeared at once.,10/27/2004,42.2669444,-79.7108333
256,4/24/2000 22:30,chino hills,ca,us,circle,30,30sec.,A big green circle came out of the sky suddenly and then desinigrated just above me,4/26/2000,33.8936111,-117.7263889
257,6/14/1974 05:30,la mesa,ca,us,triangle,120,2 min,Triangular object with three steady red lights&#44 one on each corner&#44 hovering over Miramar NAS,4/2/1999,32.7677778,-117.0222222
258,1/17/2006 06:00,orange grove,tx,us,rectangle,60,less than a minute,strange yellow 2 x 4 shaped object floating off the ground,2/1/2007,27.9563889,-97.9366667
259,12/20/2012 20:00,bremerton,wa,us,diamond,14400,4 hours,Large object in a possibly diamond shape emitting bright orange-yellow lights on the horizon over Puget Sound.,12/21/2012,47.5675,-122.6313889
260,6/8/2003 21:40,manchester,nh,us,light,300,5 min.,Flashing neon green lights across the night sky,6/10/2003,42.9955556,-71.4552778
261,3/11/2014 20:36,des moines,ia,us,disk,33,33 seconds,Disc shaped object flashing red and blue lights.,3/18/2014,41.6005556,-93.6088889
262,9/6/2005 21:30,coronado,ca,us,cigar,900.0,15 minutes,4 bright flashing light seen at a very high altitude in south Coronado bay area,10/11/2005,32.6858333,-117.1822222
263,7/1/1974 20:00,mishawaka,in,us,circle,300,5 minutes,I was a pizza delivery person back then&#44 working for Rossina Pizza in Mishawaka&#44 Indiana(they still are open). I was driving westbound,4/16/2005,41.6619444,-86.1586111
264,3/22/2013 05:35,madison,wi,us,disk,30,30 seconds,White saucer seen near Madison.,5/15/2013,43.0730556,-89.4011111
265,8/10/2007 21:00,greenwich,ny,us,triangle,480,6-8 minutes,With friends in field&#44 saw object illuminate and hover&#44 flash and then take off quite fast.,8/14/2007,43.0905556,-73.4991667
266,11/21/2012 11:18,springfield,ma,us,unknown,3600,1 hour,Strange Flashing White and Green Bright lights ascending and hovering,12/20/2012,42.1013889,-72.5902778
267,7/11/2008 17:30,midland,wa,us,circle,1800,30 min,Two bright circles staying consistantly the same distance from each other were spotted above my location. They rose into the sky moving,8/12/2008,47.1672222,-122.4036111
268,9/4/2004 09:00,glendale,az,us,teardrop,12.0,10-12 seconds,Silent black tear-drop shaped craft going above mach speed.,9/9/2004,33.5386111,-112.1852778
269,12/4/2013 16:30,hoffman estates,il,us,flash,180,3 minutes,Giant bursts of light fill sky.,12/5/2013,42.0427778,-88.0797222
270,10/8/2003 22:00,sylmar,ca,us,light,10,10 seconds,saw a light suddenly shoot down from a flying object towards the groud.,10/15/2003,34.3077778,-118.4483333
271,11/1/2013 19:11,toms brook,va,us,sphere,2580,43 minutes,Erratic moving&#44 flashing sphere of multicolored lights lingered over the WV border.,11/11/2013,38.9463889,-78.4394444
272,2/1/2012 23:00,eugene,or,us,unknown,360,6 minutes,I went outside to put the garbage and recycling containers back by the side of my house and as i was doing that i looked up over the to,2/3/2012,44.0522222,-123.0855556
273,3/31/2009 19:50,storrs,ct,us,light,1800,30 minutes,UFO over UCONN,4/14/2009,41.8083333,-72.25
274,9/10/2012 21:00,layton,ut,us,cone,3600.0,1 hour,Cone hovered above layton ut for one hour,9/24/2012,41.0602778,-111.9702778
275,9/30/2011 19:35,knoxville,tn,us,oval,300.0,5 min,West Knoxville Bright Blue Object,10/10/2011,35.9605556,-83.9208333
276,5/7/2014 21:00,theodore,al,us,circle,120,few minutes,Driving home and entered my neighborhood and saw 2 blinking lights in sky &#44 to close to be airplanes. Then later was outside with 2 oth,5/8/2014,30.5475,-88.1752778
277,7/15/2005 22:15,halifax (canada),ns,ca,triangle,240,4 minutes,There was a whilte glow around it&#44 shiny metallic material could be seen through the glow&#44 it was low enough to see good.,9/2/2005,44.65,-63.6
278,3/31/2009 00:11,new york city,ny,us,unknown,2,2 seconds,12:11am small greenish streak moving very fast through the sky over Lower Manhattan&#44 traveling west,4/14/2009,40.7141667,-74.0063889
279,1/24/2008 19:15,powder springs,ga,us,light,900,15 minutes,bright light &quot;fell&quot; from northeast sky&#44 where a circle of lights hovered for 15 minutes,2/14/2008,33.8594444,-84.6838889
280,8/3/2013 22:00,las vegas,nv,us,light,2700.0,45 minutes,Line of 9 light orbs hovered over.Las Vegas NV 8/3/13.,8/30/2013,36.175,-115.1363889
281,11/16/2003 11:30,los angeles,ca,us,other,1800,30 minutes,Stars in the mid-day sun.,11/26/2003,34.0522222,-118.2427778
282,6/20/2012 22:24,indianapolis,in,us,light,60,1 minute,Red flame flying through the sky.,7/4/2012,39.7683333,-86.1580556
283,4/23/2006 21:15,waynesboro,pa,us,triangle,12,12 seconds,Crudely &quot;cloaked&quot; bomerang object flying do West across Pennsylvania night sky,5/15/2006,39.7558333,-77.5780556
284,7/1/1995 04:30,bellevue,ne,us,unknown,60,1 minute,Silent craft flying extremely low dropping flaming embers,4/1/2000,41.1366667,-95.8905556
285,10/23/2010 21:00,phoenix,az,us,light,900,15min,Two falling balls of light---North Phoenix on 10-23-10,11/21/2010,33.4483333,-112.0733333
286,10/17/2004 18:15,raleigh,nc,us,formation,300,5 minutes,Looked like rectangle parachutes but nobody was under the canopies&#44 objects never desended.,10/27/2004,35.7719444,-78.6388889
287,8/1/2009 23:00,easton,md,us,sphere,1800,30 minutes,Three baketball sized orbs floating 2-3 feet above the ground hovering stationary and silent and glowing red,5/13/2012,38.7741667,-76.0766667
288,8/4/2013 20:12,knappa,or,us,circle,600.0,10+ minutes,Multiple lights in sky.,8/30/2013,46.1852778,-123.5847222
289,10/10/2005 23:00,hendersonville,nc,us,light,600,10 minutes,Last night&#44 October 10&#44 at about 11:00PM for about ten minutes I observed a peculiar point source light in the Eastern sky. It was at a,10/11/2005,35.3186111,-82.4611111
290,3/2/2012 20:00,st. petersburg,fl,us,circle,13,13 seconds,Bright star like object moving at a slow rate across the night sky. Within 13 seconds it slowly began to get smaller and disappeared. N,3/13/2012,27.7705556,-82.6794444
291,9/4/2008 21:00,spokane valley,wa,us,triangle,900.0,15 min.,Saw two triangular shaped objects.  Yellow to bright white.  Came up over the horizon northeast and headed   west  and upward very brig,10/31/2008,47.6733333,-117.2383333
292,6/14/2012 20:15,dana point,ca,us,changing,1500,25 minutes,Large erratically moving object over Dana Point&#44 CA,6/20/2012,33.4669444,-117.6972222
293,8/19/2004 21:00,pittsburgh,pa,us,light,900.0,15 minutes,I saw faint&#44 white lights zipping around high in the sky during a cloudy night.,9/1/2004,40.4405556,-79.9961111
294,5/27/2012 00:00,smithville,mo,us,fireball,60,1 minute,No sound flying low small fireball type,6/5/2012,39.3869444,-94.5808333
295,5/16/2013 19:10,clovis,ca,us,other,10,10 seconds,Dark three curved shaped object at Clovis&#44 CA,6/2/2013,36.8252778,-119.7019444
296,7/14/1963 21:30,hornell,ny,us,unknown,600,10 minutes,Bright object moving across the sky then stopping and going back the way it came.,7/4/2012,42.3277778,-77.6613889
297,9/12/2001 22:00,louisville (ky)/henryville (in),ky,us,other,25200.0,6-7 hours,ufos watching over america??,10/12/2001,38.2541667,-85.7594444
298,2/25/2009 15:17,seattle,wa,us,oval,60,1 minute,A glowing orange elongated orb was seen by 2 men to be moving swiftly over Seattle&#44 Washington during daylight.,3/19/2009,47.6063889,-122.3308333
299,7/24/2013 02:31,lybrook,nm,us,egg,60,1 minute,A triangular star cluster shot off an egg shaped craft southwest on 7/24/13 at 2:31 in the morning over Lybrook NM.,8/30/2013,36.2333333,-107.5616667
